{
  "schema_version": "1.0",
  "artifact_role": "WEB_OF_LIES_NATIVE_DISCOVERY_INPUT",
  "authority": "WEB_OF_LIES_INFORMATION_FORENSICS",
  "as_of": "2026-09-30T13:01:00-04:00",
  "items": [
    {
      "discovery_id": "WOL-DISC-CHOSEN-BRICK-IRAN-STATE-20260915",
      "discovery_type": "FORENSIC_DISCOVERY",
      "claim_family_ref": null,
      "subject": "CHOSEN BRICK Iranian-state cyber targeting and leak-site propagation",
      "observations": [
        {
          "date": "2026-09-15",
          "source": "UK National Cyber Security Centre with FBI and Netherlands AIVD",
          "observation_type": "JOINT_GOVERNMENT_TECHNICAL_ADVISORY",
          "statement_identity": "The joint advisory says CHOSEN BRICK malware has been used by Iranian state cyber actors to target dissidents, activists and journalists and can collect contacts, emails and social-media messages."
        },
        {
          "date": "2026-09-15",
          "source": "UK National Cyber Security Centre",
          "observation_type": "LEAK_SITE_PROPAGATION_CONTEXT",
          "statement_identity": "NCSC said personal details of some previous victims later appeared on pro-Iranian leak sites. The advisory does not identify every leak-site operator or equate those sites with Handala."
        }
      ],
      "public_receipts": [
        {
          "receipt_id": "WOL-DISC-RCPT-CHOSEN-BRICK-NCSC-NEWS-20260915",
          "surface": "WEBSITE",
          "url": "https://www.ncsc.gov.uk/news/uk-allies-expose-spyware-iranian-state-actors-target-dissidents-activists-journalists",
          "provenance_status": "ORIGINAL_URL",
          "claim_status": "JOINT_GOVERNMENT_ATTRIBUTION",
          "published_at": "2026-09-15",
          "attribution": "UK NCSC / U.S. FBI / Netherlands AIVD"
        },
        {
          "receipt_id": "WOL-DISC-RCPT-CHOSEN-BRICK-NCSC-ADVISORY-20260915",
          "surface": "WEBSITE",
          "url": "https://www.ncsc.gov.uk/news/iranian-cyber-targeting-of-dissidents-activists-and-journalists",
          "provenance_status": "ORIGINAL_URL",
          "claim_status": "TECHNICAL_ADVISORY",
          "published_at": "2026-09-15",
          "attribution": "UK NCSC with allied technical reporting"
        }
      ],
      "attribution_confidence": "HIGH_FOR_IRANIAN_STATE_ACTOR_USE_OF_CHOSEN_BRICK_AS_STATED_BY_JOINT_ADVISORY",
      "attribution_scope": "The advisory attributes CHOSEN BRICK activity to Iranian state cyber actors. It does not identify Handala as the malware operator, prove a common operator for every pro-Iranian leak site, or establish that every later leak-site publication originated from CHOSEN BRICK collection.",
      "downstream_note": "Treat malware compromise, victim-data collection, leak-site publication, and narrative amplification as separate graph events. Do not merge this discovery with Handala solely because both involve Iranian state-linked cyber activity and public leak sites.",
      "review_target": "INFORMATION_CLAIMS_AND_FORENSIC_ADJUDICATION",
      "review_reason": "This is a current public information-operation/cyber-propagation discovery with no canonical Lie Ledger family. Claims Forensics should decide whether any specific public assertion or leak-derived narrative warrants a claim family before Web of Lies scores propagation or source behavior."
    },
    {
      "discovery_id": "WOL-DISC-ETHAN-LEVINS-TWO-MISSILES-ALL-DAMAGE-20260322",
      "discovery_type": "ADJUDICATION_REVIEW_CANDIDATE",
      "claim_family_ref": null,
      "subject": "Ethan Levins assertion that all damage in Israel that day came from two missiles and that Iran had thousands more",
      "observations": [
        {
          "date": "2026-03-22",
          "source": "Ethan Levins as quoted by Press TV and secondary Telegram preservation",
          "observation_type": "DAMAGE_CAUSATION_SCALE_ASSERTION",
          "statement_identity": "The quoted statement said all the damage that day in Israel was caused by two missiles."
        },
        {
          "date": "2026-03-22",
          "source": "Ethan Levins as quoted by Press TV and secondary Telegram preservation",
          "observation_type": "MISSILE_STOCKPILE_SCALE_ASSERTION",
          "statement_identity": "The quoted statement added that Iran had thousands more missiles."
        }
      ],
      "public_receipts": [
        {
          "receipt_id": "WOL-DISC-RCPT-ETHAN-TWO-MISSILES-PRESSTV-20260322",
          "surface": "TELEGRAM",
          "url": "https://t.me/s/presstv?before=181173",
          "provenance_status": "SECONDARY_PRESERVATION",
          "claim_status": "PRESS_TV_QUOTATION_OF_ETHAN_LEVINS",
          "published_at": "2026-03-22",
          "attribution": "Press TV quoting Ethan Levins"
        },
        {
          "receipt_id": "WOL-DISC-RCPT-ETHAN-TWO-MISSILES-NEWSARTICLES-20260322",
          "surface": "TELEGRAM",
          "url": "https://t.me/s/News_Articles_Analysis?before=65363",
          "provenance_status": "SECONDARY_PRESERVATION",
          "claim_status": "SECONDARY_REPOST_OF_ATTRIBUTED_QUOTE",
          "published_at": "2026-03-22",
          "attribution": "News & Articles quoting Ethan Levins"
        }
      ],
      "attribution_confidence": "HIGH_FOR_QUOTED_WORDING_AND_SPEAKER_ATTRIBUTION; ORIGINAL_ETHAN_POST_URL_NOT_RECOVERED",
      "attribution_scope": "Two independent public Telegram preservations reproduce the same attributed wording. The original Ethan Levins post URL was not recovered in this tranche, so the discovery preserves quotation provenance rather than claiming an original-post receipt.",
      "downstream_note": "Claims Forensics should atomize the damage-causation claim separately from the missile-stockpile claim. WOL must not treat Press TV's quotation as independent corroboration of either proposition, nor infer control/agency from Press TV reuse.",
      "review_target": "INFORMATION_CLAIMS_AND_FORENSIC_ADJUDICATION",
      "review_reason": "No current canonical family cleanly adjudicates the combined March 22 proposition about all same-day Israeli damage coming from two missiles plus a remaining Iranian stockpile in the thousands.",
      "content_body_evidence": {
        "medium": "SOCIAL_POST",
        "capture_status": "FULL_TEXT_CAPTURED",
        "capture_scope": "The complete quoted passage preserved by Press TV and a second public Telegram relay is available for the two propositions recorded here. The original Ethan post URL was not recovered, so analysis is limited to the preserved quotation.",
        "transcript_receipts": [],
        "body_claims": [
          {
            "body_claim_id": "ETHAN-20260322-DAMAGE-TWO-MISSILES",
            "statement_identity": "All of the cited same-day damage in Israel was attributed to two missiles.",
            "speaker": "Ethan Levins",
            "timestamp_start": null,
            "timestamp_end": null,
            "evidence_scope": "Quoted passage preserved by two public Telegram surfaces."
          },
          {
            "body_claim_id": "ETHAN-20260322-THOUSANDS-MORE",
            "statement_identity": "Iran was said to retain thousands more missiles.",
            "speaker": "Ethan Levins",
            "timestamp_start": null,
            "timestamp_end": null,
            "evidence_scope": "Quoted passage preserved by two public Telegram surfaces."
          }
        ]
      },
      "analysis_decomposition": {
        "factual_substrate": [
          {
            "statement": "The quoted passage points to visible same-day damage in Israel as the observable substrate.",
            "evidence_status": "PUBLICLY_SUPPORTED",
            "evidence_note": "Physical damage that day is independently observable; the decomposition does not treat the quote as proof of exact causation.",
            "evidence_receipt_ids": [
              "WOL-DISC-RCPT-ETHAN-TWO-MISSILES-PRESSTV-20260322",
              "WOL-DISC-RCPT-ETHAN-TWO-MISSILES-NEWSARTICLES-20260322"
            ]
          }
        ],
        "inferential_bridges": [
          {
            "statement": "The passage attributes all referenced same-day damage to only two missiles.",
            "bridge_type": "CAUSAL_ATTRIBUTION",
            "review_status": "UPSTREAM_REVIEW_REQUIRED",
            "evidentiary_issue": "Observed damage does not by itself establish that exactly two missiles caused all of it; site-by-site strike attribution is required.",
            "competing_explanations": [
              "More than two impactors contributed to the observed damage.",
              "The quoted passage selected a subset of damage while presenting it as the whole.",
              "Damage attribution may mix direct missile effects with secondary effects."
            ]
          },
          {
            "statement": "The visible damage is used rhetorically to imply a much larger remaining strike capacity because Iran allegedly has thousands more missiles.",
            "bridge_type": "GENERALIZATION",
            "review_status": "UPSTREAM_REVIEW_REQUIRED",
            "evidentiary_issue": "Even if the damage attribution were correct, it does not establish the size, readiness, survivability or composition of Iran's remaining missile inventory.",
            "competing_explanations": [
              "Headline stockpile figures may include missiles unsuitable for the same target/effect.",
              "Inventory estimates may not reflect launchers, readiness, survivability or expendable operational stock."
            ]
          }
        ],
        "conclusions": [
          {
            "statement": "The passage implies that the observed damage demonstrates a substantially larger latent Iranian ability to reproduce or scale those effects.",
            "conclusion_type": "CAUSAL_CONCLUSION",
            "review_status": "UPSTREAM_REVIEW_REQUIRED"
          }
        ],